title,text,FeedbackText,Sentiment,SentimentLabel
Getting ripped off by Tmobile,I switched to Metro By Tmobile on October 14th at a store location. I was told Id have a hotspot on unlimited 30 plan and it was a lie. So today November 8th I have finally gotten the extra cash to go back to Tmobile and get my old hotspot plan back. I was told by the Tmobile store I went to today that if I called customer service they would reimburse me for cost of activation fee and SIM card by putting credits on my account for my next months phone bill. I had to pay 10 activation fee and 10 for a new SIM card. I was told my old Tmobile sim which I brought was invalid. So I call the customer service and the lady tells me they cant do this. I asked to speak with a manager and she tells me manager is busy and would call me back. Im still waiting. What can I do? Ive been with Tmobile since 2013 and only left because they wouldnt give me a cheaper phone plan and the Metro store said their 30 unlimited plan was exactly the same as Tmobile 50 prepaid. Im so angry right now. Boost and Verizon said I couldnt keep my same number thats the only reason I came back to this company and to be treated this way.,Getting ripped off by Tmobile. I switched to Metro By Tmobile on October 14th at a store location. I was told Id have a hotspot on unlimited 30 plan and it was a lie. So today November 8th I have finally gotten the extra cash to go back to Tmobile and get my old hotspot plan back. I was told by the Tmobile store I went to today that if I called customer service they would reimburse me for cost of activation fee and SIM card by putting credits on my account for my next months phone bill. I had to pay 10 activation fee and 10 for a new SIM card. I was told my old Tmobile sim which I brought was invalid. So I call the customer service and the lady tells me they cant do this. I asked to speak with a manager and she tells me manager is busy and would call me back. Im still waiting. What can I do? Ive been with Tmobile since 2013 and only left because they wouldnt give me a cheaper phone plan and the Metro store said their 30 unlimited plan was exactly the same as Tmobile 50 prepaid. Im so angry right now. Boost and Verizon said I couldnt keep my same number thats the only reason I came back to this company and to be treated this way,0.5,Neutral
How to get a refund,I switched to Metro on October 14th at a store location. I was told Id have a hotspot and it was a lie. So today November 8th I have finally gotten the extra cash to go back to Tmobile and get my old hotspot plan back. My question is can I get a refund for the 6 days I didnt use? I switched my original phone number from t mobile to metro and now back to Tmobile. So from what I was told the account should be canceled now. Is there a email? If not should I use LinkedIn to find someone who works at metro and ask them? What should I do? I also want to ask them to reimburse for activation charges on Tmobile as I had to pay 10 activation fee and 10 for a new SIM card.,How to get a refund. I switched to Metro on October 14th at a store location. I was told Id have a hotspot and it was a lie. So today November 8th I have finally gotten the extra cash to go back to Tmobile and get my old hotspot plan back. My question is can I get a refund for the 6 days I didnt use? I switched my original phone number from t mobile to metro and now back to Tmobile. So from what I was told the account should be canceled now. Is there a email? If not should I use LinkedIn to find someone who works at metro and ask them? What should I do? I also want to ask them to reimburse for activation charges on Tmobile as I had to pay 10 activation fee and 10 for a new SIM card,0.5,Neutral
Will T-Mobile ever offer a free Iphone upgrade to Advantage Unlimited users?,"I was moved from Sprint SERO to the now, legacy T-Mobile Advantage Unlimited plan a few years ago and want to stay on this plan. With the switch I got a free Iphone 13 by way of a 2-year monthly credit that I paid off. Now I want to upgrade to a newer phone. Will T-mo ever offer another  free phoneupgrade offer like I received to Advantage Unlimited customers? I.e., will they always require changing my plan or is there any chance I could get a 0, newer Iphone with a 2-year commitment, without having to drop Advantage Unlimited? -","Will T-Mobile ever offer a free Iphone upgrade to Advantage Unlimited users?. I was moved from Sprint SERO to the now, legacy T-Mobile Advantage Unlimited plan a few years ago and want to stay on this plan. With the switch I got a free Iphone 13 by way of a 2-year monthly credit that I paid off. Now I want to upgrade to a newer phone. Will T-mo ever offer another  free phoneupgrade offer like I received to Advantage Unlimited customers? I.e., will they always require changing my plan or is there any chance I could get a 0, newer Iphone with a 2-year commitment, without having to drop Advantage Unlimited? -",1.0,Positive
HUGE SURPRISE PLANNED for WWE RAW 128  he will be competing in KANSAS CITY IN the John Cena Last Time is Now tournament!    any guesses? tmobile ctr,"WWE Monday Night RAW Mon 8 Dec 2025 - 1830 T-Mobile Center, Kansas City, MO w CM Punk, penta, Rhea Ripley and HUGE surprise in the works","HUGE SURPRISE PLANNED for WWE RAW 128  he will be competing in KANSAS CITY IN the John Cena Last Time is Now tournament!    any guesses? tmobile ctr. WWE Monday Night RAW Mon 8 Dec 2025 - 1830 T-Mobile Center, Kansas City, MO w CM Punk, penta, Rhea Ripley and HUGE surprise in the works",0.5,Neutral
T-Mobile data not working on roaming abroad while full 5G or LTE - Mexico or Madagaskar,"Hey I have Go5G Next Data plan and I have problems with T-Mobile when I travel abroad. First time it was in Madagaskar 3 months ago. There was many times when I had full bars LTE service and it was not working. It only happened to work on 3G data. Now I am in Mexico, I have full bars 5G at the airport and I cant connect to any website. Im connected to Telcel. During my travel in Mexico, the internet was on and off on my device with T- Mobile. Its very frustrating for the amount I pay monthly and it doesnt work as it should Anyone experienced these problems? Any fix for that? I also have iPhone 15 if that matters.","T-Mobile data not working on roaming abroad while full 5G or LTE - Mexico or Madagaskar. Hey I have Go5G Next Data plan and I have problems with T-Mobile when I travel abroad. First time it was in Madagaskar 3 months ago. There was many times when I had full bars LTE service and it was not working. It only happened to work on 3G data. Now I am in Mexico, I have full bars 5G at the airport and I cant connect to any website. Im connected to Telcel. During my travel in Mexico, the internet was on and off on my device with T- Mobile. Its very frustrating for the amount I pay monthly and it doesnt work as it should Anyone experienced these problems? Any fix for that? I also have iPhone 15 if that matters",1.0,Positive
Lost Free Line,"So earlier this year, I got picked to receive a free line. I took advantage of it via Facebook and they mailed me a SIM card. I put it in my desk drawer until I needed it. Fast forward to a week ago when I wanted to buy a phone to actually use the line. I noticed that it wasnt showing under my account. I reached out to Tforce, and apparently there was an activation error on their end, which no one made me aware of, so now I have no free line. Since the promotion is gone, they said theres no way for them to fix it, so they offered me six months of free service if I add a line. I asked to speak to a supervisor, but was told that they were aware of their mistake, and that was the best they could do. I ended up complaining on the survey they sent me, so I got an email from someone. While deciding what to do, they called me and offered me an additional year of free service for the line, bringing it to 18 months. I appreciate it, but that doesnt come close to the savings of a free line! So should I try pushing this further? I know it was a free line and didnt cost me anything, but it was their mistake and I feel like they should give me what I was promised. Thanks!","Lost Free Line. So earlier this year, I got picked to receive a free line. I took advantage of it via Facebook and they mailed me a SIM card. I put it in my desk drawer until I needed it. Fast forward to a week ago when I wanted to buy a phone to actually use the line. I noticed that it wasnt showing under my account. I reached out to Tforce, and apparently there was an activation error on their end, which no one made me aware of, so now I have no free line. Since the promotion is gone, they said theres no way for them to fix it, so they offered me six months of free service if I add a line. I asked to speak to a supervisor, but was told that they were aware of their mistake, and that was the best they could do. I ended up complaining on the survey they sent me, so I got an email from someone. While deciding what to do, they called me and offered me an additional year of free service for the line, bringing it to 18 months. I appreciate it, but that doesnt come close to the savings of a free line! So should I try pushing this further? I know it was a free line and didnt cost me anything, but it was their mistake and I feel like they should give me what I was promised. Thanks!",1.0,Positive
T-Mobile vs Costco T-Mobile Financing ELI5,"So I have currently have 3 phone lines and 4 watch lines with Verizon and have been looking to switch to T-Mobile. One of the watches will become a phone line so porting in 4 phone numbers  3 watches. When I first checked with a T-mobile store and was given a promo for 1000 off each phone without trade-in and some deals on watches too. Cant remember but I think it was BoG 300off 2nd watch. There was no mention about a down payment or anything limiting the financing. I heard about the cash  Visa cards at Costco so I went there to check. Just about the first thing I heard was that theres a 3600 limit for financing so I would have to make a down payment.? However I assured I would still get the full thousand dollar credit for each of the phone lines. This is where I am confused. If I can only finance 3600 and credits stop once things are paid off, how do I get the full 4000? Also, is there a difference between Costcos T-Mobile finance limit vs a T-Mobile stores limit? Thanks for enlightening me.","T-Mobile vs Costco T-Mobile Financing ELI5. So I have currently have 3 phone lines and 4 watch lines with Verizon and have been looking to switch to T-Mobile. One of the watches will become a phone line so porting in 4 phone numbers  3 watches. When I first checked with a T-mobile store and was given a promo for 1000 off each phone without trade-in and some deals on watches too. Cant remember but I think it was BoG 300off 2nd watch. There was no mention about a down payment or anything limiting the financing. I heard about the cash  Visa cards at Costco so I went there to check. Just about the first thing I heard was that theres a 3600 limit for financing so I would have to make a down payment.? However I assured I would still get the full thousand dollar credit for each of the phone lines. This is where I am confused. If I can only finance 3600 and credits stop once things are paid off, how do I get the full 4000? Also, is there a difference between Costcos T-Mobile finance limit vs a T-Mobile stores limit? Thanks for enlightening me",0.5,Neutral
WTh is this ???,I just went to my Google wallet and I see this being added... What is this for? It doesnt really feel like is a special treatment it just looks like one one those thing that says HELLO MY NAME IS.... cant wait to leave TMobile in 2 months,WTh is this ???. I just went to my Google wallet and I see this being added... What is this for? It doesnt really feel like is a special treatment it just looks like one one those thing that says HELLO MY NAME IS.... cant wait to leave TMobile in 2 months,1.0,Positive
Using the Tmo credit card in 2 accounts,Can I use my T-mobile credit card in two different accounts and still get the 2 back? I am Primary of one account and authorized in another. And i pay the bill for both. Perks of having a big family!,Using the Tmo credit card in 2 accounts. Can I use my T-mobile credit card in two different accounts and still get the 2 back? I am Primary of one account and authorized in another. And i pay the bill for both. Perks of having a big family!,0.5,Neutral
Advice On How to Unscrew Myself My Phone Number In Limbo,"Some of this is more of a carrier question, I know, but I really just need advice on how to proceed. Bullet points of important details AND UPDATE at the end Recently, I got an iPhone 14 Pro Max new phone from my dad. Its a hammy down and he was using it for two years with T-Mobile. The device Im upgrading FROM is a IPhones 7 old phone, Ive had it for about 6 years and Ive had the same number attached to it the whole time. The goal is to keep that number. When trying to transfer between devices there was no problem except for the phone numbercell data. Apparently the new phone had been locked and the most reasonable conclusion after talking to my own provider, Straight Talk was to call T-Mobile to unlock it because my dad had been using it on the new phone just fine so obviously they had some control. I had my dad call them, and they say they unlocked it. Which seemed to be the case because now the phone would recognize the transfer instead of immediately suggesting I transfer using a phone with an updated IOS. Also note My old phone has only been able to get up to 15.8.something as of this morning. So heres the problem. I try doing it on my own again, and tell MY carriers automated machine that Im ready to transfer, but upon clicking Set Up on the new device a error pops up This eSIM cannot be supported or transferred, please contact your carrier for more details. So as I had done before I call mine first for advice, its not the same woman but she tries her best. She guarantees that number is safe which is awesome but because we cant authenticate my account I would have to set up the eSIM somehow. Another note I made the pin to authenticate my account a little bit after I got it. On my own. In middle school. During Covid. The only way Id remember is by troubleshooting the very few numbers I WOULDVE used back then. Im willing to do that, but after eight tries, she was not, Anyway, I talk to T-Mobile and theyre telling ME they say the iMEI number wasnt associated with them, whichI cannot even guess what that means for me, but I doubt its true. But she said if the phones still saying its locked despite what I said happened then she couldnt help. ANYWAY I lied before. Trying to transfer on my own wasnt my dumbest moment. My dumbest moment was FACTORY RESETTING MY PHONE to help it recognize it has been unlocked. NOW it doesnt even give me any other option besides scanning a QR code, setting up manually, or transferring from an IOS 16 device.  Got a phone from my dad  Everything transferred but the number  I call my carrier. Apparently its locked. We assume Tmobile because thats my dads carrier. They say call back once its unlocked.  He calls. They say they unlocked it.  I try transferring my number on my own. I get hit with another eSIM not supported but were further than before so thats good.  I call my carrier. I cant authenticate because I moved my number off my old phone. They say I need to set up the eSIM then come back  I call TMobile. They claim the device wasnt even associated with them, which I call BS.  Then I FACTORY RESET IT and omg I literally cant justify why I thought itd do any goodI thought itd help recognize the phone being unlocked.  The phone doesnt even recognize the progress I made before. Now Im here. With my number in limbo and no real way to proceed. If you guys can even just tell me who to talk to next that would be great. Update After visiting Apple in my local mall, they were able to identify that T-Mobile had NOT completely unlocked my device. So I was sent down to T-Mobile and spoke to a very nice woman about it and after being put on my dads account as an authorized user we made a call and it turns out the reason my device hadnt been completely freed was because of a payment my dad missed. Yeah. Anyway about 140 dollars in the hole BUT thats not all because after calling Straight Talk, it turns out my carrier hasnt been able to carry over is because there is an outage? Gonna look more into what that is but it means that Ill have to wait another 2-3 days before anything changes. Which means the problem is on hiatus.","Advice On How to Unscrew Myself My Phone Number In Limbo. Some of this is more of a carrier question, I know, but I really just need advice on how to proceed. Bullet points of important details AND UPDATE at the end Recently, I got an iPhone 14 Pro Max new phone from my dad. Its a hammy down and he was using it for two years with T-Mobile. The device Im upgrading FROM is a IPhones 7 old phone, Ive had it for about 6 years and Ive had the same number attached to it the whole time. The goal is to keep that number. When trying to transfer between devices there was no problem except for the phone numbercell data. Apparently the new phone had been locked and the most reasonable conclusion after talking to my own provider, Straight Talk was to call T-Mobile to unlock it because my dad had been using it on the new phone just fine so obviously they had some control. I had my dad call them, and they say they unlocked it. Which seemed to be the case because now the phone would recognize the transfer instead of immediately suggesting I transfer using a phone with an updated IOS. Also note My old phone has only been able to get up to 15.8.something as of this morning. So heres the problem. I try doing it on my own again, and tell MY carriers automated machine that Im ready to transfer, but upon clicking Set Up on the new device a error pops up This eSIM cannot be supported or transferred, please contact your carrier for more details. So as I had done before I call mine first for advice, its not the same woman but she tries her best. She guarantees that number is safe which is awesome but because we cant authenticate my account I would have to set up the eSIM somehow. Another note I made the pin to authenticate my account a little bit after I got it. On my own. In middle school. During Covid. The only way Id remember is by troubleshooting the very few numbers I WOULDVE used back then. Im willing to do that, but after eight tries, she was not, Anyway, I talk to T-Mobile and theyre telling ME they say the iMEI number wasnt associated with them, whichI cannot even guess what that means for me, but I doubt its true. But she said if the phones still saying its locked despite what I said happened then she couldnt help. ANYWAY I lied before. Trying to transfer on my own wasnt my dumbest moment. My dumbest moment was FACTORY RESETTING MY PHONE to help it recognize it has been unlocked. NOW it doesnt even give me any other option besides scanning a QR code, setting up manually, or transferring from an IOS 16 device.  Got a phone from my dad  Everything transferred but the number  I call my carrier. Apparently its locked. We assume Tmobile because thats my dads carrier. They say call back once its unlocked.  He calls. They say they unlocked it.  I try transferring my number on my own. I get hit with another eSIM not supported but were further than before so thats good.  I call my carrier. I cant authenticate because I moved my number off my old phone. They say I need to set up the eSIM then come back  I call TMobile. They claim the device wasnt even associated with them, which I call BS.  Then I FACTORY RESET IT and omg I literally cant justify why I thought itd do any goodI thought itd help recognize the phone being unlocked.  The phone doesnt even recognize the progress I made before. Now Im here. With my number in limbo and no real way to proceed. If you guys can even just tell me who to talk to next that would be great. Update After visiting Apple in my local mall, they were able to identify that T-Mobile had NOT completely unlocked my device. So I was sent down to T-Mobile and spoke to a very nice woman about it and after being put on my dads account as an authorized user we made a call and it turns out the reason my device hadnt been completely freed was because of a payment my dad missed. Yeah. Anyway about 140 dollars in the hole BUT thats not all because after calling Straight Talk, it turns out my carrier hasnt been able to carry over is because there is an outage? Gonna look more into what that is but it means that Ill have to wait another 2-3 days before anything changes. Which means the problem is on hiatus",1.0,Positive
Dmann is the goat,"Anthony has some magic hands and I just want to say if yall are thinking about getting tuned, go dmann 100. I was out with a few of my buddies tonight and I was putting bus lengths on rt chargers and barely beating a scat pack. Like damn, the FA24 and Dmann tuning really make this engine feel like a baby B58.","Dmann is the goat. Anthony has some magic hands and I just want to say if yall are thinking about getting tuned, go dmann 100. I was out with a few of my buddies tonight and I was putting bus lengths on rt chargers and barely beating a scat pack. Like damn, the FA24 and Dmann tuning really make this engine feel like a baby B58",1.0,Positive
Is it possible to add the Yearly Upgrade benefit?,"I have one line on my plan Go5G Plus that is enrolled in Yearly Upgrade former iPhone Forever Upgrade. Is it possible to add it to one or more of the other lines on my account? I am asking because there was a recent post about someone successfully adding One Plus Promo to the other lines on their account, so sounds like its still possible to add grandfathered SOCs to other lines if you already have it on your account. Thanks","Is it possible to add the Yearly Upgrade benefit?. I have one line on my plan Go5G Plus that is enrolled in Yearly Upgrade former iPhone Forever Upgrade. Is it possible to add it to one or more of the other lines on my account? I am asking because there was a recent post about someone successfully adding One Plus Promo to the other lines on their account, so sounds like its still possible to add grandfathered SOCs to other lines if you already have it on your account. Thanks",0.5,Neutral
New account via Costco,"Hi all, just signed up for T-Mobile via Costco yesterday. I got the Experience Beyond plan for 3 lines 2 paid, 1 free and 3 iPhone 17 Pros with 1,000 credit no trade-in required. The Costco rep told me the max credit approval was always limited to 3600 for new accounts so I could only get 3 lines with the new phones. The only alternative was to open a business account which I did not do. My questions are 1. I want to bring over 2 additional lines from ATT, how do I do this with the 3600 equipment credit cap? 2. Since my account is new and I get one free line, can I not take advantage of another BOGO right now? 3. If I can use another BOGO, what code do I need to give the reps? 4. I got 20 off added, will doing a BOGO mess that up?","New account via Costco. Hi all, just signed up for T-Mobile via Costco yesterday. I got the Experience Beyond plan for 3 lines 2 paid, 1 free and 3 iPhone 17 Pros with 1,000 credit no trade-in required. The Costco rep told me the max credit approval was always limited to 3600 for new accounts so I could only get 3 lines with the new phones. The only alternative was to open a business account which I did not do. My questions are 1. I want to bring over 2 additional lines from ATT, how do I do this with the 3600 equipment credit cap? 2. Since my account is new and I get one free line, can I not take advantage of another BOGO right now? 3. If I can use another BOGO, what code do I need to give the reps? 4. I got 20 off added, will doing a BOGO mess that up?",1.0,Positive
"I have the T-Mobile unlimited Kickstarter plan, is there anything else better?",I havent looked at plans for so long ... Is there anything even close to the unlimited Kickstarter for 45 that I currently have??,"I have the T-Mobile unlimited Kickstarter plan, is there anything else better?. I havent looked at plans for so long ... Is there anything even close to the unlimited Kickstarter for 45 that I currently have??",1.0,Positive
Account Cancelled?,My T-mobile account was cancelled. Long story short my hours at my job were cut in half and just my luck I was dealing with some health issues so all the money I had was going to my medical bills which im still trying to pay i fell about 2-3 months behind my bill and now my account is cancelled. I made a 345 payment yesterday morning. Im not sure what I can do? Can anyone help!,Account Cancelled?. My T-mobile account was cancelled. Long story short my hours at my job were cut in half and just my luck I was dealing with some health issues so all the money I had was going to my medical bills which im still trying to pay i fell about 2-3 months behind my bill and now my account is cancelled. I made a 345 payment yesterday morning. Im not sure what I can do? Can anyone help!,0.0,Negative
Can I trade in a phone still on EIP,"...to 1. CostcoT mobile? 2. Apple w TMO financing? 3. Samsung w TMO financing? I have regular vanilla Go5G Plus. Secondly, razr 2024 is showing OOS, but also a ship date in Dec. What are the chances it comes back in stock while the holiday deals are running?","Can I trade in a phone still on EIP. ...to 1. CostcoT mobile? 2. Apple w TMO financing? 3. Samsung w TMO financing? I have regular vanilla Go5G Plus. Secondly, razr 2024 is showing OOS, but also a ship date in Dec. What are the chances it comes back in stock while the holiday deals are running?",0.5,Neutral
