title,text,FeedbackText,Sentiment,SentimentLabel
"Apparently, I know nothing, please help","So I have an Alienware Area 51 18 with a 5090 in it and a DGX Spark. I am trying to learn to make my own ai agents. I used to do networking stuff with Unifi, Starlink, Tmobile, etc, but I am way out of my element. My goal is to start automating as much as I can for passive income. I am starting with using my laptop to control the DGX to buil a networking agent that can diagnose and fix this stuff on its own. ChatGPT has helped a ton but I seem to find myself in a loop now. I am having an issue with the agent being able to communicate with my laptop in order for me to issue commands. Obviously, much of this can be done locally, but I do not want to have to lug this thing around everywhere.","Apparently, I know nothing, please help. So I have an Alienware Area 51 18 with a 5090 in it and a DGX Spark. I am trying to learn to make my own ai agents. I used to do networking stuff with Unifi, Starlink, Tmobile, etc, but I am way out of my element. My goal is to start automating as much as I can for passive income. I am starting with using my laptop to control the DGX to buil a networking agent that can diagnose and fix this stuff on its own. ChatGPT has helped a ton but I seem to find myself in a loop now. I am having an issue with the agent being able to communicate with my laptop in order for me to issue commands. Obviously, much of this can be done locally, but I do not want to have to lug this thing around everywhere",1.0,Positive
Not for existing customers?,"I have the Go5G Next plan, I have an iPhone 15 Pro, all paid off. I try to shop and respond to this promo to upgrade my device, but as soon as asks if Im an existing customer and to login, then the price jumps to 11mo and Im forced to get a new number? Terms doesnt say anything about new customers only, and existing customers on Go5G Next are supposed to get the same deals as new customers. What gives?","Not for existing customers?. I have the Go5G Next plan, I have an iPhone 15 Pro, all paid off. I try to shop and respond to this promo to upgrade my device, but as soon as asks if Im an existing customer and to login, then the price jumps to 11mo and Im forced to get a new number? Terms doesnt say anything about new customers only, and existing customers on Go5G Next are supposed to get the same deals as new customers. What gives?",0.5,Neutral
Considering switching,"Hi Im considering switching to T-Mobile. It would just be one line, need a new phone iPhone 17, usually do the the pro maxs but probably down sizing with this next phone. May get a new iPad and upgrade my watch with them but dont necessarily need internet on either, so it just depends on if it makes sense to or not. As far as streaming, I have Hulu for free through Spotify. Dont use Disney. Already have access to Netflix. Im - nurse and an Amazon employee, and I believe we can get a discount, and I also have a Costco membership not sure if its a better deal there or Best Buy vs in T-Mobile stores?? What would you recommend for me as far as plans go?","Considering switching. Hi Im considering switching to T-Mobile. It would just be one line, need a new phone iPhone 17, usually do the the pro maxs but probably down sizing with this next phone. May get a new iPad and upgrade my watch with them but dont necessarily need internet on either, so it just depends on if it makes sense to or not. As far as streaming, I have Hulu for free through Spotify. Dont use Disney. Already have access to Netflix. Im - nurse and an Amazon employee, and I believe we can get a discount, and I also have a Costco membership not sure if its a better deal there or Best Buy vs in T-Mobile stores?? What would you recommend for me as far as plans go?",1.0,Positive
New tablets,"New tablets I currently have a pair of 32gb Galaxy Tab A7 on my account that are quite old and slowing down. Theyre used by my kids for streaming video and learning apps like ABC Mouse, plus they like to take pictures with them which absolutely fill the onboard memory. We are currently on the Go5GPlus plan and are locked in for another 11 months due to our phone promotions. I stopped by a local authorized retailer who said they have Galaxy Tab A95G available, but theres no upgrade promotions - only for new lines. QUESTIONS  Is it true you now have to avoid any line removals for six months instead of three months to keep a new line promo?  She suggested moving the insurance to the new tablets since the old ones wont be in use anymore, and then she could put the old tablets on a lower plan, doing that would result in our bill only going up about seven dollars a month until the old tablets are removed, then our bill would actually drop lower than where it is now. she told me this, she did not show me anything on paper  I dont see any tablet plan options for the new ones that would save money compared to our current plans, how can our bill end up going lower?","New tablets. New tablets I currently have a pair of 32gb Galaxy Tab A7 on my account that are quite old and slowing down. Theyre used by my kids for streaming video and learning apps like ABC Mouse, plus they like to take pictures with them which absolutely fill the onboard memory. We are currently on the Go5GPlus plan and are locked in for another 11 months due to our phone promotions. I stopped by a local authorized retailer who said they have Galaxy Tab A95G available, but theres no upgrade promotions - only for new lines. QUESTIONS  Is it true you now have to avoid any line removals for six months instead of three months to keep a new line promo?  She suggested moving the insurance to the new tablets since the old ones wont be in use anymore, and then she could put the old tablets on a lower plan, doing that would result in our bill only going up about seven dollars a month until the old tablets are removed, then our bill would actually drop lower than where it is now. she told me this, she did not show me anything on paper  I dont see any tablet plan options for the new ones that would save money compared to our current plans, how can our bill end up going lower?",0.5,Neutral
When will outdoor hotspot be able to offload to tmobile like indoor hotspot,I see on the map the indoor hotspots in commercial locations are able to use tmobile and att and have significantly higher usage. Whereas all of the outdoor hotspots in commercial locations only use att and get much less rewards. Is there any way to fix this? Maybe a way to use an indoor hotspot with a high power outdoor wifi antenna?,When will outdoor hotspot be able to offload to tmobile like indoor hotspot. I see on the map the indoor hotspots in commercial locations are able to use tmobile and att and have significantly higher usage. Whereas all of the outdoor hotspots in commercial locations only use att and get much less rewards. Is there any way to fix this? Maybe a way to use an indoor hotspot with a high power outdoor wifi antenna?,1.0,Positive
Phone insurance through new T-Mobile Credit Card?,"So I, like many here, have been doing the autopay loophole that T-Mobile just closed up. It looks like they are now releasing their own credit card which allows you to keep autopay along with cash back rewards. What is interesting is it doesnt say anything about phone insurance, however it does say you get all the Visa Signature perks which does include phone insurance... It seems like this would be a big point for T-Mobile to advertise on their new card but they dont do it. Does that mean that Visa Signature perk is not valid or they are just trying to hide it?","Phone insurance through new T-Mobile Credit Card?. So I, like many here, have been doing the autopay loophole that T-Mobile just closed up. It looks like they are now releasing their own credit card which allows you to keep autopay along with cash back rewards. What is interesting is it doesnt say anything about phone insurance, however it does say you get all the Visa Signature perks which does include phone insurance... It seems like this would be a big point for T-Mobile to advertise on their new card but they dont do it. Does that mean that Visa Signature perk is not valid or they are just trying to hide it?",1.0,Positive
Check your bill if you opened a free line last month.,"If you open a new free line last month, then please check your bill. T-mobile might added extra charges to your line without your knowledge. T-mobile randomly added 15 SC 6GB data SMHS and 11 One time charge Telesales  Weborder charge. Like wtf is Telesales  Weborder charge? Good thing I caught it this morning, and have them reverted. Sneaky bastards.","Check your bill if you opened a free line last month.. If you open a new free line last month, then please check your bill. T-mobile might added extra charges to your line without your knowledge. T-mobile randomly added 15 SC 6GB data SMHS and 11 One time charge Telesales  Weborder charge. Like wtf is Telesales  Weborder charge? Good thing I caught it this morning, and have them reverted. Sneaky bastards",0.5,Neutral
Unique International Calling Situation,"I cant seem to get a straight answer on how International Calling works. I have someone who has their phone overseas, Magenta Military 1.0 plan. They need to be able to call US numbers from their US phone while in the UK, what type of plan add on do I need for that? They dont need to be able to call anyone in the UK, they just happen to be there.","Unique International Calling Situation. I cant seem to get a straight answer on how International Calling works. I have someone who has their phone overseas, Magenta Military 1.0 plan. They need to be able to call US numbers from their US phone while in the UK, what type of plan add on do I need for that? They dont need to be able to call anyone in the UK, they just happen to be there",1.0,Positive
T-Mobile Credit Card Autopay Discount for Free 3rd Line?,Does anyone know if you can get the 5 off per line with autopay for the free 3rd line as well when using the T-Mobile credit card?,T-Mobile Credit Card Autopay Discount for Free 3rd Line?. Does anyone know if you can get the 5 off per line with autopay for the free 3rd line as well when using the T-Mobile credit card?,1.0,Positive
Magenta upgrades,"Hey everyone! Ive got a quick question about Magenta upgrades were on a veteranmilitary plan, if that makes a difference. Last year around Black Friday, there was an amazing deal basically an any trade-in for a flagship phone on us kind of offer. One of the users on our plan really needs a new phone, but were not sure if that same deal or something similar will return this year. If its expected to come back, hes happy to wait. If not, hell go ahead and upgrade now. Anyone have any insight or predictions? Thanks in advance!","Magenta upgrades. Hey everyone! Ive got a quick question about Magenta upgrades were on a veteranmilitary plan, if that makes a difference. Last year around Black Friday, there was an amazing deal basically an any trade-in for a flagship phone on us kind of offer. One of the users on our plan really needs a new phone, but were not sure if that same deal or something similar will return this year. If its expected to come back, hes happy to wait. If not, hell go ahead and upgrade now. Anyone have any insight or predictions? Thanks in advance!",1.0,Positive
PIXEL PRO 10 256 ..... MIA,This is the worst experience from a carrier. The Un-carrier true to their slogan. Dont have phones to sell?,PIXEL PRO 10 256 ..... MIA. This is the worst experience from a carrier. The Un-carrier true to their slogan. Dont have phones to sell?,0.0,Negative
Should I tradein my old device if tmobile pays it off?,"TMobile just launched a new promo - 4 lines on essentials can get new iphone 17s for free without any tradein needed. My situation is we have 4 lines on Att and one lines device has balance to be paid off and I would like to use Tmobiles keep and switch rebate for that one device but get new phones for the other 3 lines. When I visited costco yesterday, the rep said if tmobile pays off that device, we should trade that in and get a new device and there is no option to just keep it. That did not make sense to me. Did anyone else hear similar?","Should I tradein my old device if tmobile pays it off?. TMobile just launched a new promo - 4 lines on essentials can get new iphone 17s for free without any tradein needed. My situation is we have 4 lines on Att and one lines device has balance to be paid off and I would like to use Tmobiles keep and switch rebate for that one device but get new phones for the other 3 lines. When I visited costco yesterday, the rep said if tmobile pays off that device, we should trade that in and get a new device and there is no option to just keep it. That did not make sense to me. Did anyone else hear similar?",1.0,Positive
Best Card For UtilityMTA  T-Mobile?,"RESOLVED So I need a card that can preferably get me 5 on utilities Con Edison and public transit MTA. I currently have Future card. What I see online is USBank and Elan Max. Just wondering if anyone has any DP on the specific companies mentioned since it looks to vary. Ive only heard bad things about Elan Financial but does their issues apply to me? Im only going to spend like 600 a month. Lastly, does T-Mobile take Discover for their 1. Still want autopay Thanks All. I will be getting USBank and TMobile CC sometime down the line since I need to get Venture X first","Best Card For UtilityMTA  T-Mobile?. RESOLVED So I need a card that can preferably get me 5 on utilities Con Edison and public transit MTA. I currently have Future card. What I see online is USBank and Elan Max. Just wondering if anyone has any DP on the specific companies mentioned since it looks to vary. Ive only heard bad things about Elan Financial but does their issues apply to me? Im only going to spend like 600 a month. Lastly, does T-Mobile take Discover for their 1. Still want autopay Thanks All. I will be getting USBank and TMobile CC sometime down the line since I need to get Venture X first",0.5,Neutral
Switching from Verizon iPhone 11. What are the best deals or trade-in offers right now for new iPhone?,"I have been with Verizon for over 15 years. I have an iPhone 11 regular version thats paid off. My monthly plan at Verizon is about 115month, unlimited data Internet and texting its the 5G Play More Plan. Would be fine with a comparable or better plan if its similar cost or less. Verizon has its own upgrade offer, but I think Id like to switch carriers. Not sure if T-Mobile or ATT is better. I need a new phone as well, ideally the new iPhone 17. If I go through T-Mobile, whats the best deal I could do? And would the new phone be carrier locked? Not sure if I should do T-Mobile or ATT or something through Costco.","Switching from Verizon iPhone 11. What are the best deals or trade-in offers right now for new iPhone?. I have been with Verizon for over 15 years. I have an iPhone 11 regular version thats paid off. My monthly plan at Verizon is about 115month, unlimited data Internet and texting its the 5G Play More Plan. Would be fine with a comparable or better plan if its similar cost or less. Verizon has its own upgrade offer, but I think Id like to switch carriers. Not sure if T-Mobile or ATT is better. I need a new phone as well, ideally the new iPhone 17. If I go through T-Mobile, whats the best deal I could do? And would the new phone be carrier locked? Not sure if I should do T-Mobile or ATT or something through Costco",1.0,Positive
Wanted to switch to T-Mobile today almost did but its more expensive than Verizon,"Kinda bummed that T-Mobile is the new Verizon in terms of cost and Verizon is cheaper now. Got all the way to the port progress before canceling. Went through Costco and was getting 225 in Costco cards and 500 in prepaid visa which is a pretty good deal for BYOD. The reason why I pulled it is the T-Mobile rep said 225 for my 2 experience beyond lines, 2 watches and an iPad while I pay Verizon 185 for UU, UP, 2 watches, iPad and Xbox game pass with Verizon. The Costco rep said it would be around 193. Man, what T-Mobile is doing is the opposite of what they used to he despite their network improvements. On the flip side, I can switch to att with my bundled fiber and pay 140 for equivalent services. Probably end up sticking with Verizon now. While Verizon isnt the best anymore, they are improving and solid overall, especially at a cheaper price point than T-Mobile. Edit we have 17s that we bought from Apple. We get Apple TV from Apple one premier. Disney Hulu bundle with 10 credit with the Amex BCP. Netflix we pay for no ads. Could I get Netflix with ads and upgrade and pay the difference?","Wanted to switch to T-Mobile today almost did but its more expensive than Verizon. Kinda bummed that T-Mobile is the new Verizon in terms of cost and Verizon is cheaper now. Got all the way to the port progress before canceling. Went through Costco and was getting 225 in Costco cards and 500 in prepaid visa which is a pretty good deal for BYOD. The reason why I pulled it is the T-Mobile rep said 225 for my 2 experience beyond lines, 2 watches and an iPad while I pay Verizon 185 for UU, UP, 2 watches, iPad and Xbox game pass with Verizon. The Costco rep said it would be around 193. Man, what T-Mobile is doing is the opposite of what they used to he despite their network improvements. On the flip side, I can switch to att with my bundled fiber and pay 140 for equivalent services. Probably end up sticking with Verizon now. While Verizon isnt the best anymore, they are improving and solid overall, especially at a cheaper price point than T-Mobile. Edit we have 17s that we bought from Apple. We get Apple TV from Apple one premier. Disney Hulu bundle with 10 credit with the Amex BCP. Netflix we pay for no ads. Could I get Netflix with ads and upgrade and pay the difference?",1.0,Positive
Credits? Let me get your thoughts as a customer,"Hypothetically, if Im able to see credits on your account and if I can see when your credits are going to fall off, would you want me to let you know ahead of time that your credits were coming to an end and if so, and my only solution is for you to call customer service. Would you appreciate that or not or would you maybe be possibly hassle me and tell me that I should fix that even though there is no way for me to do that from my end?","Credits? Let me get your thoughts as a customer. Hypothetically, if Im able to see credits on your account and if I can see when your credits are going to fall off, would you want me to let you know ahead of time that your credits were coming to an end and if so, and my only solution is for you to call customer service. Would you appreciate that or not or would you maybe be possibly hassle me and tell me that I should fix that even though there is no way for me to do that from my end?",1.0,Positive
20 off Per Month1 year,"Head to chat on T-Life and tell them you are switching to a MVNO that will save you 60 per month. With that savings, you will subscribe to Netflix, Hulu, and Apple yourself and still pay less than T-Mobile. Thats when they will shoot you 20 off per month for 12 months.","20 off Per Month1 year. Head to chat on T-Life and tell them you are switching to a MVNO that will save you 60 per month. With that savings, you will subscribe to Netflix, Hulu, and Apple yourself and still pay less than T-Mobile. Thats when they will shoot you 20 off per month for 12 months",0.0,Negative
Mint Mobile and StraightTalk,Right now Im paying and a leg for tmobile. Does anyone have any experience with Mint Mobile or StraightTalk? Hows reception in Winston-Salem and the surrounding areas?,Mint Mobile and StraightTalk. Right now Im paying and a leg for tmobile. Does anyone have any experience with Mint Mobile or StraightTalk? Hows reception in Winston-Salem and the surrounding areas?,1.0,Positive
Google Pixel 7pro unlocked psim to Google Pixel 10 pro esim on T-Mobile Questions,"Hello All, I have an existing T-Mo psim on my current Pixel 7 pro and purchased a new Pixel 10 pro in the US which only has esim. Is it easy to convert the psim to an esim during the process of setting up the Pixel 10 pro? I have the T-life app setup on the Pixel 7 pro already. Can this conversion and move be done during the Pixel 10 Pro setup or will I have to visit the store or call customer service to make this happen? Or should I convert the psim to esim on the Pixel 7 pro first and then only then do an esim based 7 pro to 10 pro transfer? The T-Mo docs seem to imply that I just need to follow the prompts while setup on the Pixel 10 pro and everything will be kosher once I connect to a wifi. But I am very skeptical that it will this easy. Any advice is appreciated, dont want to get stuck in between with a deactivated 7 pro and a 10 pro that does not setup from psim to esim Thanks","Google Pixel 7pro unlocked psim to Google Pixel 10 pro esim on T-Mobile Questions. Hello All, I have an existing T-Mo psim on my current Pixel 7 pro and purchased a new Pixel 10 pro in the US which only has esim. Is it easy to convert the psim to an esim during the process of setting up the Pixel 10 pro? I have the T-life app setup on the Pixel 7 pro already. Can this conversion and move be done during the Pixel 10 Pro setup or will I have to visit the store or call customer service to make this happen? Or should I convert the psim to esim on the Pixel 7 pro first and then only then do an esim based 7 pro to 10 pro transfer? The T-Mo docs seem to imply that I just need to follow the prompts while setup on the Pixel 10 pro and everything will be kosher once I connect to a wifi. But I am very skeptical that it will this easy. Any advice is appreciated, dont want to get stuck in between with a deactivated 7 pro and a 10 pro that does not setup from psim to esim Thanks",1.0,Positive
How often do they have a free line promo?,"Took too long to call in for the free line promo email I received and was told its no longer available. Was thinking of using that line to get my son his first phone for xmas. Anyone know how often they run this promo? Think itll happen again before Xmas, or maybe his bday in April?","How often do they have a free line promo?. Took too long to call in for the free line promo email I received and was told its no longer available. Was thinking of using that line to get my son his first phone for xmas. Anyone know how often they run this promo? Think itll happen again before Xmas, or maybe his bday in April?",1.0,Positive
"So, T-Mobile straight up full on lied to me. What are my options?","tldr I was placed into a multi year contract via phone without it being explained to me. What are my options? 1. In 2024, I was wildly overcharged for reasons that werent explained to me clearly. I called in one day with an intention to close my account. I was offered a lower rate plan. No fine print. No documentation. No disclosures. I said yes. 2. Fast forward to today. I needed new phones. I was eligible. I went to the store to pick them up. IT TOOK THREE HOURS for them to do the account research and let me know that the lower rate plan was a multi year lock in. With no Equipment Financing. 3. T-Mobile wants to charge me 700 per line to switch my plan even if I stay with TMobile. In order to get device financing. And they have stated Im completely locked into my current contract. 4. I was so livid. The people in the store and on the phone did their best. Everyone acknowledged that this is bullshit and they dont understand how this exists. 5. I am 100000 done with T-Mobile. I have been a customer for over a decade. Theyve gotten unreasonably bad. I am leaving no matter what. Questions - What can I do here? - Do you know of anyone else like ATTVerizon buying out contracts? Thank you Bill","So, T-Mobile straight up full on lied to me. What are my options?. tldr I was placed into a multi year contract via phone without it being explained to me. What are my options? 1. In 2024, I was wildly overcharged for reasons that werent explained to me clearly. I called in one day with an intention to close my account. I was offered a lower rate plan. No fine print. No documentation. No disclosures. I said yes. 2. Fast forward to today. I needed new phones. I was eligible. I went to the store to pick them up. IT TOOK THREE HOURS for them to do the account research and let me know that the lower rate plan was a multi year lock in. With no Equipment Financing. 3. T-Mobile wants to charge me 700 per line to switch my plan even if I stay with TMobile. In order to get device financing. And they have stated Im completely locked into my current contract. 4. I was so livid. The people in the store and on the phone did their best. Everyone acknowledged that this is bullshit and they dont understand how this exists. 5. I am 100000 done with T-Mobile. I have been a customer for over a decade. Theyve gotten unreasonably bad. I am leaving no matter what. Questions - What can I do here? - Do you know of anyone else like ATTVerizon buying out contracts? Thank you Bill",1.0,Positive
I opened 3 Fanatics Topps 25-26 Blaster Boxes,"Insane amount of hits. 2 coopers, 1 rookie relic, 1 numbered card, 8 parallels, lots of rookie base, and a shit tonne of fun. If I miscounted my pulls, please forgive me.","I opened 3 Fanatics Topps 25-26 Blaster Boxes. Insane amount of hits. 2 coopers, 1 rookie relic, 1 numbered card, 8 parallels, lots of rookie base, and a shit tonne of fun. If I miscounted my pulls, please forgive me",0.0,Negative
