title,text,FeedbackText,Sentiment,SentimentLabel
Anyone with fiber have issues with Nintendo switch online?,My friend said the network uses CGNAT and I may have difficulty with tmobilemetronets fiber when using switch online. I also torrent at times and he said that could be an issue too? Just curious what your experience has been. We had a new install in my neighborhood. Cant beat the 10 year price guarantee or the unlimited data. I went over 50gb last month and paid and extra 60 with my current provider.,Anyone with fiber have issues with Nintendo switch online?. My friend said the network uses CGNAT and I may have difficulty with tmobilemetronets fiber when using switch online. I also torrent at times and he said that could be an issue too? Just curious what your experience has been. We had a new install in my neighborhood. Cant beat the 10 year price guarantee or the unlimited data. I went over 50gb last month and paid and extra 60 with my current provider,0.5,Neutral
Help with quote,"I was working on a quote for a friend a bit ago and just need to know if this is accurate. So the new iPhone promos love em include iPhone 17s with port and no trade on the 4 for 100 plan the limit on the promotion is 4 However, my friend has 5 lines. He has two phones that will be doing the family freedom program. Since the phone gets traded in, in that situation anyway its a different promotion. Are those two promotions combinable and would he be able to get all 5 phones on promotion? 3 no trade port, and 2 with trade? Thanks in advance to anyone who can help.","Help with quote. I was working on a quote for a friend a bit ago and just need to know if this is accurate. So the new iPhone promos love em include iPhone 17s with port and no trade on the 4 for 100 plan the limit on the promotion is 4 However, my friend has 5 lines. He has two phones that will be doing the family freedom program. Since the phone gets traded in, in that situation anyway its a different promotion. Are those two promotions combinable and would he be able to get all 5 phones on promotion? 3 no trade port, and 2 with trade? Thanks in advance to anyone who can help",1.0,Positive
Buying Vivo In The US,"Im super interested in buying the vivo x300 pro global as soon as it becomes available but I have some questions 1. Being in the US, is there anything I should worry about service, phone shutting off, etc 2. Will I be able to use Google products and google workspace? 3. Will it work on tmobile i know it has an ESim I currently have a Samsung s24 ultra and Im tired of the same old same old. Please let me know whatever you can!","Buying Vivo In The US. Im super interested in buying the vivo x300 pro global as soon as it becomes available but I have some questions 1. Being in the US, is there anything I should worry about service, phone shutting off, etc 2. Will I be able to use Google products and google workspace? 3. Will it work on tmobile i know it has an ESim I currently have a Samsung s24 ultra and Im tired of the same old same old. Please let me know whatever you can!",1.0,Positive
US Cellular spotted using n41,I assume this is TMobiles n41 spectrum?,US Cellular spotted using n41. I assume this is TMobiles n41 spectrum?,0.5,Neutral
Porting Out Question,"Im looking to port out to ATT while theyre offering up to 800line to switch from a competitor. My main question is when and how will I get the final bill? How will my current phone get unlocked when porting out? Ive only been with T-Mobile for about 5 months, but service in my workplace isnt great, so need to switch back to ATT. I know ATT isnt paying for my final bill - which means I will fork out the money first to pay off and get reimbursed, but my main concern would be collections after reading some horror stories for port outclosing accounts.","Porting Out Question. Im looking to port out to ATT while theyre offering up to 800line to switch from a competitor. My main question is when and how will I get the final bill? How will my current phone get unlocked when porting out? Ive only been with T-Mobile for about 5 months, but service in my workplace isnt great, so need to switch back to ATT. I know ATT isnt paying for my final bill - which means I will fork out the money first to pay off and get reimbursed, but my main concern would be collections after reading some horror stories for port outclosing accounts",1.0,Positive
Need help with phone unlocking,My grandmother paid for her iPhone fully before getting on a T-Mobile plan with my aunt. My grandmother has since bought a new phone through ATT and had given my younger brother her carrier locked phone. Is there any way we can get the fully paid iPhone unlocked from the carrier T-Mobile?,Need help with phone unlocking. My grandmother paid for her iPhone fully before getting on a T-Mobile plan with my aunt. My grandmother has since bought a new phone through ATT and had given my younger brother her carrier locked phone. Is there any way we can get the fully paid iPhone unlocked from the carrier T-Mobile?,0.5,Neutral
Struggling with T-Mobile Still,"I cannot for the life of me get my PlayStation portal to work with my IPhone 16 pro hotspot - either for cloud gaming or remote play. -PS5 is hooked up to home wifi -Hotspot is through TMobile, which a lot of people have said you have to do network setting manually- tried that, no luck -iOS is up to date -no luck when I turn on or off max compatibility If anyone has any advice Id love to hear it, thank you in advance!!","Struggling with T-Mobile Still. I cannot for the life of me get my PlayStation portal to work with my IPhone 16 pro hotspot - either for cloud gaming or remote play. -PS5 is hooked up to home wifi -Hotspot is through TMobile, which a lot of people have said you have to do network setting manually- tried that, no luck -iOS is up to date -no luck when I turn on or off max compatibility If anyone has any advice Id love to hear it, thank you in advance!!",1.0,Positive
3 Weeks of Intermittent Connection,"A few weeks ago, we started experiencing what tech support representatives referred to as intermittent network disruptions in our area. Home internet and cell phone service both included. Customer service has not been able to give me any clear answers on when it will be resolved. After over a dozen phone calls over the last few weeks, I was finally told that the tower in our area is not able to be updated due to the owner of the land that the tower is on not allowing the technicians on to the property to complete the updates needed. Weve been with T-Mobile for over 3 years now and have loved it and never had an overnight change like this. Now I feel like Im getting the run around on whether or not they can even resolve the issue at any point in time. I work from home and Im losing income because I cannot stay connected. I cannot maintain a phone call, load a video on social media, stream Netflix, or run or update applications or games on my smart TVs or video game console. I have also willingly done every trouble shooting option with tech support available to me. Speed tests show a download speed of 4.53 Mbps and upload speeds of 0. We have had the gateway and our cellphones checked to make sure it wasnt a device issue too. Service works great everywhere but in our own neighborhood. Has anyone ever experienced any issue like this? Im slowly but surely losing hope of it improving and shopping around to see my options. Any suggestions appreciated. Thanks in advance.","3 Weeks of Intermittent Connection. A few weeks ago, we started experiencing what tech support representatives referred to as intermittent network disruptions in our area. Home internet and cell phone service both included. Customer service has not been able to give me any clear answers on when it will be resolved. After over a dozen phone calls over the last few weeks, I was finally told that the tower in our area is not able to be updated due to the owner of the land that the tower is on not allowing the technicians on to the property to complete the updates needed. Weve been with T-Mobile for over 3 years now and have loved it and never had an overnight change like this. Now I feel like Im getting the run around on whether or not they can even resolve the issue at any point in time. I work from home and Im losing income because I cannot stay connected. I cannot maintain a phone call, load a video on social media, stream Netflix, or run or update applications or games on my smart TVs or video game console. I have also willingly done every trouble shooting option with tech support available to me. Speed tests show a download speed of 4.53 Mbps and upload speeds of 0. We have had the gateway and our cellphones checked to make sure it wasnt a device issue too. Service works great everywhere but in our own neighborhood. Has anyone ever experienced any issue like this? Im slowly but surely losing hope of it improving and shopping around to see my options. Any suggestions appreciated. Thanks in advance",1.0,Positive
Just got rid of Hulu Live TV,"We found we were hardly watching live tv anymore. Instead, we have the Hulu, Disney, and ESPN Unlimited all with ads with HBO Max, Starz, and ShowtimeParamount add ons. Our bill went from 123 to 56 We get a 7 rebate by paying for Hulu with my Blue Cash AMEX card. We also have Prime Video, AMC, Netflix, Apple TV from Tmobile, and Peacock through Walmart. Theres also Pluto and Tubi TV. If my husband can still get his fill of sports broadcasts, we will probably keep it at this.","Just got rid of Hulu Live TV. We found we were hardly watching live tv anymore. Instead, we have the Hulu, Disney, and ESPN Unlimited all with ads with HBO Max, Starz, and ShowtimeParamount add ons. Our bill went from 123 to 56 We get a 7 rebate by paying for Hulu with my Blue Cash AMEX card. We also have Prime Video, AMC, Netflix, Apple TV from Tmobile, and Peacock through Walmart. Theres also Pluto and Tubi TV. If my husband can still get his fill of sports broadcasts, we will probably keep it at this",0.5,Neutral
BOGO Free Line Promo Question,"Has anyone seen andor taken advantage of this offer? It says the discount is applied after checkout out, which makes me a bit nervous itll get messed up. Any quirks  catches I should be aware of? I am on Go5G Plus with 2 paid lines, 1 free phone line from earlier this year, 1 free tablet line from years ago, and a watch line.","BOGO Free Line Promo Question. Has anyone seen andor taken advantage of this offer? It says the discount is applied after checkout out, which makes me a bit nervous itll get messed up. Any quirks  catches I should be aware of? I am on Go5G Plus with 2 paid lines, 1 free phone line from earlier this year, 1 free tablet line from years ago, and a watch line",1.0,Positive
Swapping out phone s on some of my lines,"Hi. I have some discounted lines on my plan. Can I swap in a phone  that I have on another cell phone with another company? How do I go about doing that? I assume if I drop lines and add lines, I will lose the discount.","Swapping out phone s on some of my lines. Hi. I have some discounted lines on my plan. Can I swap in a phone  that I have on another cell phone with another company? How do I go about doing that? I assume if I drop lines and add lines, I will lose the discount",0.5,Neutral
Commission on new T-Mobile credit card?,"Former employee here...are they having yall current employees pressure people into signing up for the new credit card in store? If so, is there any type of spiff or compensation for doing so? Curious, because it seems like this company has been going to shit for a long while now but the shitification has significantly ramped up in the past 1-2 years. Have they made credit card applications a metric yet?","Commission on new T-Mobile credit card?. Former employee here...are they having yall current employees pressure people into signing up for the new credit card in store? If so, is there any type of spiff or compensation for doing so? Curious, because it seems like this company has been going to shit for a long while now but the shitification has significantly ramped up in the past 1-2 years. Have they made credit card applications a metric yet?",0.5,Neutral
Motorola Edge 60 Pro anyone in Usa running this model?,"I am always a Pixel man have the Pixel 9 and Pixel 9 Pro XL but I like the texture, durability and feel of the moto phones. The vegan plastic back and matt plastic frames. Makes for a lighter phone and I like to go caseless. I am on Us Mobil which runs Tmobile, anyone get this phone which is international only for usa and sells on Amazon for 545 right now. For right price say 300 to 350 I would maybe order one to try out.","Motorola Edge 60 Pro anyone in Usa running this model?. I am always a Pixel man have the Pixel 9 and Pixel 9 Pro XL but I like the texture, durability and feel of the moto phones. The vegan plastic back and matt plastic frames. Makes for a lighter phone and I like to go caseless. I am on Us Mobil which runs Tmobile, anyone get this phone which is international only for usa and sells on Amazon for 545 right now. For right price say 300 to 350 I would maybe order one to try out",1.0,Positive
Refurbished Galaxy S24 Plus different CSCs,"Hi, I just bought a refurbished, carrier-unlocked Galaxy S24 SM-S926U from Back Market to replace my S21FE which I loved. I had previously bought one from Amazon, but it wouldnt download software updates, so I returned it instead of trying a firmware flash. I started this phone with my TMobile SIM already inserted, and everything updated. I can see it was originally a TMobile phone in the US, so Im not sure if this has anything to do with it. I used Phone Doctor to check the phones mechanics, and everything checked out well. Ive done an IMEI check, and nothing shows blacklisted or problematic. Its in almost new condition, and so far, everything seems to be working fine, and its great - and I want to buy refurbished phones if they work for me. But, I want to review a few things before fully committing to this phone and setting it all the way up, and wondering if someone could help. 1 My firmware build is the latest TMB build for SM-S926U, according to Samfw.com . But, my service provider software version shows TMBTMB,TMBXAUTMB Can anyone interpret this? I dont have much experience with CSC and firmware, but Ive done a lot of internet investigating and I havent seen five symbols three slashes before. Its my understanding that, going from left to right, the first is the CSC of the current firmware build, the second and third are separated by a comma to indicate the first and second SIM position CSCs, and typically the fourth is the last symbol that indicates the original CSC as manufactured and sold and cannot be changed. Is that correct? In this case, there is another slash and a fifth symbol. So, Im wondering if there is anything to be concerned about. Would it affect future software updates, or if I change carriers? 2 I want to use the phone in Ecuador next year, and Kimovil indicates the SM-S926U variant should have all the radio bands there. Does anyone know if I could have problems loading a SIM in Ecuador, or how I might go about finding out short of going and testing it out!? Thanks for any help!","Refurbished Galaxy S24 Plus different CSCs. Hi, I just bought a refurbished, carrier-unlocked Galaxy S24 SM-S926U from Back Market to replace my S21FE which I loved. I had previously bought one from Amazon, but it wouldnt download software updates, so I returned it instead of trying a firmware flash. I started this phone with my TMobile SIM already inserted, and everything updated. I can see it was originally a TMobile phone in the US, so Im not sure if this has anything to do with it. I used Phone Doctor to check the phones mechanics, and everything checked out well. Ive done an IMEI check, and nothing shows blacklisted or problematic. Its in almost new condition, and so far, everything seems to be working fine, and its great - and I want to buy refurbished phones if they work for me. But, I want to review a few things before fully committing to this phone and setting it all the way up, and wondering if someone could help. 1 My firmware build is the latest TMB build for SM-S926U, according to Samfw.com . But, my service provider software version shows TMBTMB,TMBXAUTMB Can anyone interpret this? I dont have much experience with CSC and firmware, but Ive done a lot of internet investigating and I havent seen five symbols three slashes before. Its my understanding that, going from left to right, the first is the CSC of the current firmware build, the second and third are separated by a comma to indicate the first and second SIM position CSCs, and typically the fourth is the last symbol that indicates the original CSC as manufactured and sold and cannot be changed. Is that correct? In this case, there is another slash and a fifth symbol. So, Im wondering if there is anything to be concerned about. Would it affect future software updates, or if I change carriers? 2 I want to use the phone in Ecuador next year, and Kimovil indicates the SM-S926U variant should have all the radio bands there. Does anyone know if I could have problems loading a SIM in Ecuador, or how I might go about finding out short of going and testing it out!? Thanks for any help!",1.0,Positive
Changing Carrier in a Poor Service Area,"Ive had Verizon for over a decade but it was through a family plan and my parents paid. This arrangement is coming to an end and I need to secure my own plan dont want to continue with Verizon if possible. The problem is that i live in a rural area with poor coverage so I need to determine that an alternative company will provide equal or better coverage to Verizon. Would any of you brainiacs know the simplest way to go about this. I am completely ignorant about burner phones, but assumed this would be a way to try out TMobile, ATT, etc. without committing to a contract and hoping itll work. Any better ideas out there?","Changing Carrier in a Poor Service Area. Ive had Verizon for over a decade but it was through a family plan and my parents paid. This arrangement is coming to an end and I need to secure my own plan dont want to continue with Verizon if possible. The problem is that i live in a rural area with poor coverage so I need to determine that an alternative company will provide equal or better coverage to Verizon. Would any of you brainiacs know the simplest way to go about this. I am completely ignorant about burner phones, but assumed this would be a way to try out TMobile, ATT, etc. without committing to a contract and hoping itll work. Any better ideas out there?",1.0,Positive
iPhone upgrade at Apple,Can I upgrade my iPhone at Apple when I still have a 500 balance owed on the go5gplus plan 12 out of 24 credits applied. Tmobiles page shows I still owe the 500 but Apple doesnt. Whats the deal? Can I upgrade at Apple without having to pay off the 500 balance? The Apple website only asks for tax but doesnt ask for the remaining balance. Thanks!,iPhone upgrade at Apple. Can I upgrade my iPhone at Apple when I still have a 500 balance owed on the go5gplus plan 12 out of 24 credits applied. Tmobiles page shows I still owe the 500 but Apple doesnt. Whats the deal? Can I upgrade at Apple without having to pay off the 500 balance? The Apple website only asks for tax but doesnt ask for the remaining balance. Thanks!,1.0,Positive
Old Simple Choice Free Tablet Line - How much data should I be getting?,"I have an old Free On Us tablet line from years ago. Its been dormant in a old Netgear LTE modem for a long time racking up 1.40 fees every month. I picked up a 5G Inseego modem for cheap to see if itd work - and it does! Im getting 20-100 mBit throughput in my testing. Curiously, Ive pulled in over 20 GB of data at those speeds according to my monitor app. The line is Simple Choice North America 6GB MI. Did that get un-capped when the Simple-Choice uncapping happened a few years ago? Any Caveats?","Old Simple Choice Free Tablet Line - How much data should I be getting?. I have an old Free On Us tablet line from years ago. Its been dormant in a old Netgear LTE modem for a long time racking up 1.40 fees every month. I picked up a 5G Inseego modem for cheap to see if itd work - and it does! Im getting 20-100 mBit throughput in my testing. Curiously, Ive pulled in over 20 GB of data at those speeds according to my monitor app. The line is Simple Choice North America 6GB MI. Did that get un-capped when the Simple-Choice uncapping happened a few years ago? Any Caveats?",1.0,Positive
iPhone 17 Promotions Current TMobile Customer,"Hi, Whats the best promotion out there to get a new iPhone for a current T-mobile customer? Any information would be greatly appreciated. Are there typically deals during black Friday? I can hold out a few weeks if I can get a better deal. Thanks!","iPhone 17 Promotions Current TMobile Customer. Hi, Whats the best promotion out there to get a new iPhone for a current T-mobile customer? Any information would be greatly appreciated. Are there typically deals during black Friday? I can hold out a few weeks if I can get a better deal. Thanks!",1.0,Positive
Any early insight into Black Friday deals?,"I have Go5G and am holding off to see if they bump the trade in from 830 to 1000. If not, I would rather order my phone sooner than later.","Any early insight into Black Friday deals?. I have Go5G and am holding off to see if they bump the trade in from 830 to 1000. If not, I would rather order my phone sooner than later",0.5,Neutral
Who wins this matchup?,"Prime Connor vs Prime Topuria, who you got? I think Connor does Ilia worse than he did Aldo","Who wins this matchup?. Prime Connor vs Prime Topuria, who you got? I think Connor does Ilia worse than he did Aldo",0.5,Neutral
T-Mobile eSim bites,"I got a Pixel 10 on one line, which forced me to get an eSim on that line. I was assured that eSim swapping is trivial. It was trivial to deactivate the physical sim and put it on this line. However, today, I tried to move that eSim to a Samsung Fold 3 phone. When I try I get a message that I have to call T-Mobile and give them Support Code 511 which is basically, problem with eSim movement. eSim is not locked. Triple checked. The Pixel 10 is T-Mobile locked. The Fold 3 is unlocked and Ive used it many times on T-Mobile with physical sim. I call T-Mobile and get a message--after waiting 10 minutes, that theres a 25 minute wait ahead. Screw that, I have stuff to do. WTF. So eSim is basically a dumpster file, just as I worried when I switched?","T-Mobile eSim bites. I got a Pixel 10 on one line, which forced me to get an eSim on that line. I was assured that eSim swapping is trivial. It was trivial to deactivate the physical sim and put it on this line. However, today, I tried to move that eSim to a Samsung Fold 3 phone. When I try I get a message that I have to call T-Mobile and give them Support Code 511 which is basically, problem with eSim movement. eSim is not locked. Triple checked. The Pixel 10 is T-Mobile locked. The Fold 3 is unlocked and Ive used it many times on T-Mobile with physical sim. I call T-Mobile and get a message--after waiting 10 minutes, that theres a 25 minute wait ahead. Screw that, I have stuff to do. WTF. So eSim is basically a dumpster file, just as I worried when I switched?",0.5,Neutral
Go5G user who signed up for Hulu ON US almost a year ago Am I going to still get Hulu for free after 12 months is up? Or will they start charging me automatically?,"This is what my Manage add-ons page shows. My understanding is, normally you need the Go5G Next plan to get Hulu for free, but T-Mobile gave it to people on Go5G Plus who already Netflix On Us enabled as of 152024. Not sure if they just gave it to us for free for 12 months, or if Ill continue to get it for free even with Go5G plan.","Go5G user who signed up for Hulu ON US almost a year ago Am I going to still get Hulu for free after 12 months is up? Or will they start charging me automatically?. This is what my Manage add-ons page shows. My understanding is, normally you need the Go5G Next plan to get Hulu for free, but T-Mobile gave it to people on Go5G Plus who already Netflix On Us enabled as of 152024. Not sure if they just gave it to us for free for 12 months, or if Ill continue to get it for free even with Go5G plan",1.0,Positive
Google fi to tmobile on 4100 promo,My question is that online it lets me complete the purchase even though its from google fi but when i went to sams to avoid the fees guy said google fi doesnt work for this deal which makes sense. If i complete the purchase online will they catch it later that its from google fi and jack the price up on me or take away the free phones?,Google fi to tmobile on 4100 promo. My question is that online it lets me complete the purchase even though its from google fi but when i went to sams to avoid the fees guy said google fi doesnt work for this deal which makes sense. If i complete the purchase online will they catch it later that its from google fi and jack the price up on me or take away the free phones?,1.0,Positive
