title,text,FeedbackText,Sentiment,SentimentLabel
Porting out a number tied to a financed device...,"If I port one of the numbers to another device on, lets say on Google FI, will the balance of said device come due? Or can i have a new number generated for that device? We are wanting to get a phone line for my kid, but I also want to try out Google Fi and see how it works for me since i travel more than my wife and kid... Tmobile support is being less than helpful... Any help here would be greatly appreciated. Thanks!","Porting out a number tied to a financed device.... If I port one of the numbers to another device on, lets say on Google FI, will the balance of said device come due? Or can i have a new number generated for that device? We are wanting to get a phone line for my kid, but I also want to try out Google Fi and see how it works for me since i travel more than my wife and kid... Tmobile support is being less than helpful... Any help here would be greatly appreciated. Thanks!",1.0,Positive
Auto Pay Discount Debit Card,"Is it possible to pay early using a linked debit card? If so, will we still get the same discount? Anyone know? I like to pay my bill early if possible. Appreciate the help.","Auto Pay Discount Debit Card. Is it possible to pay early using a linked debit card? If so, will we still get the same discount? Anyone know? I like to pay my bill early if possible. Appreciate the help",0.5,Neutral
TMobile 5G  ssh,"I am currently using spectrum and have my router setup to do port forwarding so I can ssh home. Can I do the same using the tmobile 5g? If not, what about setting it in some passthrough mode so I can put a router behind it?","TMobile 5G  ssh. I am currently using spectrum and have my router setup to do port forwarding so I can ssh home. Can I do the same using the tmobile 5g? If not, what about setting it in some passthrough mode so I can put a router behind it?",0.0,Negative
T-Mobile 5G UC Problems,"hi, i live in west virginia. we used to get awesom service especially up to 700mbps on 5G UC. for the past 6 months or more it ahs plummeted and nothing wants to load on 5G UC. 5G extended range is ok and LTE is awesome still but when it goes to UC its really bad. everyone i know across 30 towers are having the same issues. Home internet connects to UC and has no problems what so ever. what is happening dude??","T-Mobile 5G UC Problems. hi, i live in west virginia. we used to get awesom service especially up to 700mbps on 5G UC. for the past 6 months or more it ahs plummeted and nothing wants to load on 5G UC. 5G extended range is ok and LTE is awesome still but when it goes to UC its really bad. everyone i know across 30 towers are having the same issues. Home internet connects to UC and has no problems what so ever. what is happening dude??",1.0,Positive
Dark Star QCI 7,Both Tmobile and Verizon are dead in the water. Only my line with Dark Star paired with QCI 7 works. YOU ROCK US MOBILE!,Dark Star QCI 7. Both Tmobile and Verizon are dead in the water. Only my line with Dark Star paired with QCI 7 works. YOU ROCK US MOBILE!,0.0,Negative
Can I switch to go5gplus 9 line SOC,"I currently have 6 lines, 3 paid 3 free in go5gplus. I intend on taking advantage of free lines in the future to fill 9 lines. Is it possible to be switched right now to the 9 line SOC, so that Im future proof? I also currently get Hulu for free. Will it knock that off, or will it stay if Im able to switch.","Can I switch to go5gplus 9 line SOC. I currently have 6 lines, 3 paid 3 free in go5gplus. I intend on taking advantage of free lines in the future to fill 9 lines. Is it possible to be switched right now to the 9 line SOC, so that Im future proof? I also currently get Hulu for free. Will it knock that off, or will it stay if Im able to switch",1.0,Positive
Is it possible to port a number from a phone to a watch.,"I switched from Verizon today, and also got a watch. The number still has not ported over, but in the app it says transfer number complete and the watch has my old number I wanted ported over. While the phone says no transferring number found and lists a temporary number. I did this process maybe 4 hours ago now, really hoping I dont need to go back to the store.","Is it possible to port a number from a phone to a watch.. I switched from Verizon today, and also got a watch. The number still has not ported over, but in the app it says transfer number complete and the watch has my old number I wanted ported over. While the phone says no transferring number found and lists a temporary number. I did this process maybe 4 hours ago now, really hoping I dont need to go back to the store",0.5,Neutral
How do I use my iPhone voicemail greeting instead of T-Mobiles?,"When I go into my iPhone phone app  Voicemail  Greeting and select Default, I get a really clear-sounding generic greeting that doesnt mention my name or phone number. However, after selecting this, it doesnt stick. When someone calls me, they get the T-Mobile voicemail greeting, which sounds really scratchy like its coming from 1000 miles away and speaks my phone number, which is the most anonymous T-Mobile option that was available. Strangely, my wifes iPhone, which is exactly the same as mine and is on the exact same rate plan as mine with the same features, plays the iPhone greeting when you call her phone. How do I get my phone to play the iPhone greeting instead of the T-Mobile greeting?","How do I use my iPhone voicemail greeting instead of T-Mobiles?. When I go into my iPhone phone app  Voicemail  Greeting and select Default, I get a really clear-sounding generic greeting that doesnt mention my name or phone number. However, after selecting this, it doesnt stick. When someone calls me, they get the T-Mobile voicemail greeting, which sounds really scratchy like its coming from 1000 miles away and speaks my phone number, which is the most anonymous T-Mobile option that was available. Strangely, my wifes iPhone, which is exactly the same as mine and is on the exact same rate plan as mine with the same features, plays the iPhone greeting when you call her phone. How do I get my phone to play the iPhone greeting instead of the T-Mobile greeting?",1.0,Positive
Question about device payoff when switching.,I want to take advantage of the device payoff for people switching to T-Mobile. Im pretty sure if I try to port from Verizon to T-Mobile that Verizon will hit me with an additional fee and not just make the remainder owed on the device due. Do I have to show them how much is due on the device at the time I port my number or can I pay the device off a day or two before and bring in the receipt from the device payoff. What exactly do I have to provide to get that reimbursement?,Question about device payoff when switching.. I want to take advantage of the device payoff for people switching to T-Mobile. Im pretty sure if I try to port from Verizon to T-Mobile that Verizon will hit me with an additional fee and not just make the remainder owed on the device due. Do I have to show them how much is due on the device at the time I port my number or can I pay the device off a day or two before and bring in the receipt from the device payoff. What exactly do I have to provide to get that reimbursement?,1.0,Positive
Trouble with metro by tmobile hotspot on android,Ive been trying to use my portal with my mobile hotspot from my android but it just gives me an error screen every time I try to connect. I have tried changing the IP adress settings from different tutorials but nothing seems to work. I am only able to use it with my home wifi. Anyone have a solution?,Trouble with metro by tmobile hotspot on android. Ive been trying to use my portal with my mobile hotspot from my android but it just gives me an error screen every time I try to connect. I have tried changing the IP adress settings from different tutorials but nothing seems to work. I am only able to use it with my home wifi. Anyone have a solution?,0.5,Neutral
Cant sign up for T-Mobile,"Trying to sign up online for T-Mobile because Verizon service has gotten progressively worse at our home to the point where its unusable. Verizon is way too expensive to not be getting reliable service anymore. I went through the signup process and on the checkout page, the Accept  Continue button is greyed out. Its greyed out because there are three buttons at the bottom, all of which must be checked. And the middle one says By checking this box, I agree that T-Mobile, or others acting on its behalf, may call or text me at the number provided above to receive updates and offers, and that they may use an autodialer, artificial voices, or pre-recordings to do so. I understand that my consent is not a condition of purchasing any goods or services, and that I may revoke it at any time. I dont want that. And it specifically says consent is not a condition of purchase. But the form wont submit unless its checked, so it sure seems like it is. I also found that the iPad and smartwatch plans were automatically put on the most expensive plan in the cart, with no way to change or edit that. It also limited me to switching 5 lines, though thats a much smaller problem. Depending on what Verizon does when the main phone on the account gets switched away and the only devices left are two iPads and a watch. So I wanted to ask if there was a way to fix that and sign up without consenting to robocalls. When I tried to use the online customer service, the person said he could not help me unless I filled out a form first. The form asked for a lot of personal information and had several additional tabs one of which made it look like it was going to ask for ID. ...and the form had a link to a privacy policy saying the information collected would be used and sold for marketing purposes. I know all these companies all sell data right and left, but that felt excessive  intrusive just to ask a couple of questions, so I bailed at that point. Is there, in fact, any way to sign up for service without consenting to robocalls, preferably while also obtaining the 10mo plans for tablets and watches?","Cant sign up for T-Mobile. Trying to sign up online for T-Mobile because Verizon service has gotten progressively worse at our home to the point where its unusable. Verizon is way too expensive to not be getting reliable service anymore. I went through the signup process and on the checkout page, the Accept  Continue button is greyed out. Its greyed out because there are three buttons at the bottom, all of which must be checked. And the middle one says By checking this box, I agree that T-Mobile, or others acting on its behalf, may call or text me at the number provided above to receive updates and offers, and that they may use an autodialer, artificial voices, or pre-recordings to do so. I understand that my consent is not a condition of purchasing any goods or services, and that I may revoke it at any time. I dont want that. And it specifically says consent is not a condition of purchase. But the form wont submit unless its checked, so it sure seems like it is. I also found that the iPad and smartwatch plans were automatically put on the most expensive plan in the cart, with no way to change or edit that. It also limited me to switching 5 lines, though thats a much smaller problem. Depending on what Verizon does when the main phone on the account gets switched away and the only devices left are two iPads and a watch. So I wanted to ask if there was a way to fix that and sign up without consenting to robocalls. When I tried to use the online customer service, the person said he could not help me unless I filled out a form first. The form asked for a lot of personal information and had several additional tabs one of which made it look like it was going to ask for ID. ...and the form had a link to a privacy policy saying the information collected would be used and sold for marketing purposes. I know all these companies all sell data right and left, but that felt excessive  intrusive just to ask a couple of questions, so I bailed at that point. Is there, in fact, any way to sign up for service without consenting to robocalls, preferably while also obtaining the 10mo plans for tablets and watches?",0.5,Neutral
Cell Phone Protection after tmo loophole closed,Does anyone here use the Bilt card to pay their cell phone bill but do it using a routing  account number so the carrier sees it as a bank account? TMobile just closed a loop hole where customers would manually pay the bill with a credit card before it was due. They still received autopay discount basically 5line. Now you cant do that anymore. Curious if similar to how the rent payments work if we can do something similar for paying TMobile bill?,Cell Phone Protection after tmo loophole closed. Does anyone here use the Bilt card to pay their cell phone bill but do it using a routing  account number so the carrier sees it as a bank account? TMobile just closed a loop hole where customers would manually pay the bill with a credit card before it was due. They still received autopay discount basically 5line. Now you cant do that anymore. Curious if similar to how the rent payments work if we can do something similar for paying TMobile bill?,0.5,Neutral
Advice for best Holiday Deal,"Ive held out and waited for any holiday deals that are available, so I guess now is the time. Im already on T-Mobile on my wifes plan and Im happy with my current S22 Ultra, so I dont really need a phone per se, but if I do, it will be Samsung. Im leaving her plan and getting my own. I can go either consumer or business. Im interested in a tablet line and maybe also a hotspot. I dont really need more than one phone line, but its a definite possibility down the road in the near future so if it makes sense to take advantage of any deals or promos now Im willing to do that. I see the essentials deal, but Ill need a few more inclusions than that plan. I know its new lines for these deals, but could I do the three line option where the third line is free and port my existing number to that third line? Since its a free line, I dont know if thats a workaround so I can still keep my current number and port that in since her plan will be losing a line. Whats my best option right now? Im assuming going to Costco or Sams is still the best bet as well. Edit staying on my wifes plan is not an option for various reasons. This will cost me what it costs me, Im just trying to get the best deal out of it.","Advice for best Holiday Deal. Ive held out and waited for any holiday deals that are available, so I guess now is the time. Im already on T-Mobile on my wifes plan and Im happy with my current S22 Ultra, so I dont really need a phone per se, but if I do, it will be Samsung. Im leaving her plan and getting my own. I can go either consumer or business. Im interested in a tablet line and maybe also a hotspot. I dont really need more than one phone line, but its a definite possibility down the road in the near future so if it makes sense to take advantage of any deals or promos now Im willing to do that. I see the essentials deal, but Ill need a few more inclusions than that plan. I know its new lines for these deals, but could I do the three line option where the third line is free and port my existing number to that third line? Since its a free line, I dont know if thats a workaround so I can still keep my current number and port that in since her plan will be losing a line. Whats my best option right now? Im assuming going to Costco or Sams is still the best bet as well. Edit staying on my wifes plan is not an option for various reasons. This will cost me what it costs me, Im just trying to get the best deal out of it",1.0,Positive
ATT roaming in East Texas still active,"Cherokee County, Texas still has ATT roaming. I know that Jacksonville has a T-Mobile store but ever since Ive been coming here in 2018, its always roamed to ATT. Ive gotten faster speeds beforehand, which is weird but its working fine for me.","ATT roaming in East Texas still active. Cherokee County, Texas still has ATT roaming. I know that Jacksonville has a T-Mobile store but ever since Ive been coming here in 2018, its always roamed to ATT. Ive gotten faster speeds beforehand, which is weird but its working fine for me",0.5,Neutral
Anybodys CellSpot V2 Femtocell still working?,"Mine has stopped with just the first 2 lights flashing, Ive tried every troubleshooting step over I can find over the last week except one that says the fix is for t-mobile to delete my Connectivity Device Profile and then set it back up as new. The rep told me they cant or wont do that.","Anybodys CellSpot V2 Femtocell still working?. Mine has stopped with just the first 2 lights flashing, Ive tried every troubleshooting step over I can find over the last week except one that says the fix is for t-mobile to delete my Connectivity Device Profile and then set it back up as new. The rep told me they cant or wont do that",0.5,Neutral
honestly is my phone compromised? look at this URL,"every URL looks very bizarre lots of redirects, seems like APIs or something. account.t-mobile.comsigninv2?redirect_uri just went to tmobile.com and hit login","honestly is my phone compromised? look at this URL. every URL looks very bizarre lots of redirects, seems like APIs or something. account.t-mobile.comsigninv2?redirect_uri just went to tmobile.com and hit login",1.0,Positive
T-Mobile Is Handing Out Free Flagship Phones For The Holidays,T-Mobile Is Handing Out Free Flagship Phones For The Holidays,T-Mobile Is Handing Out Free Flagship Phones For The Holidays. T-Mobile Is Handing Out Free Flagship Phones For The Holidays,1.0,Positive
1000 Off Promo Duration,"T-Mobile announced a deal yesterday that really caught my attention  1000 off any iPhone 17 model or iPhone Air  no trade-in required!  when switching a line to T-Mobile on Experience Beyond This was part of their early Black Friday press release Apologies if this an idiotic question, but is it likely that this promo will change before Black Friday? Or do these deals normally last until Black Friday and maybe beyond? Just want to make sure I dont miss out on that specific promo. Thanks!","1000 Off Promo Duration. T-Mobile announced a deal yesterday that really caught my attention  1000 off any iPhone 17 model or iPhone Air  no trade-in required!  when switching a line to T-Mobile on Experience Beyond This was part of their early Black Friday press release Apologies if this an idiotic question, but is it likely that this promo will change before Black Friday? Or do these deals normally last until Black Friday and maybe beyond? Just want to make sure I dont miss out on that specific promo. Thanks!",0.5,Neutral
Anyone in the Chicagoland area still having horrifically slow 5G home internet?,Its been on and off rough for the past three weeks. Are they going to fix this?,Anyone in the Chicagoland area still having horrifically slow 5G home internet?. Its been on and off rough for the past three weeks. Are they going to fix this?,0.0,Negative
What is a good T-Mobile hotspot device to make sure of cell phone connectivity in the boonies?,"Most of what Ive found seems like devices for laptops only, but we will need to ensure connectivity via cell phone in places where only T-Mobile seems to have signal. Im not looking to be able to stream video or play games, but will need internet access and reliable cell signal for credit card processing. Any recommendations?","What is a good T-Mobile hotspot device to make sure of cell phone connectivity in the boonies?. Most of what Ive found seems like devices for laptops only, but we will need to ensure connectivity via cell phone in places where only T-Mobile seems to have signal. Im not looking to be able to stream video or play games, but will need internet access and reliable cell signal for credit card processing. Any recommendations?",1.0,Positive
Trade in terms expires TOMORROW,"Im upgrading an iPhone 15, trading in the device, online order. When I view the Trade in Terms document, it has my device details listed with an expiration date of TOMORROW. Also If you fail to return your Device by the trade-in expiration date, you may be required to pay back any value or credit advanced to you. The new device isnt even going to ship for a couple days, so the expiration date makes no sense. I shouldnt agree to this and abandon the order, right?!?","Trade in terms expires TOMORROW. Im upgrading an iPhone 15, trading in the device, online order. When I view the Trade in Terms document, it has my device details listed with an expiration date of TOMORROW. Also If you fail to return your Device by the trade-in expiration date, you may be required to pay back any value or credit advanced to you. The new device isnt even going to ship for a couple days, so the expiration date makes no sense. I shouldnt agree to this and abandon the order, right?!?",0.5,Neutral
Anyone have the Revvl 8?,"Got this phone a few days ago. It seems decent so far. Only thing thats getting at me is photos. It seems theres so many folders the photos get put into. Like if Im on google and a I save a photo then I open my gallery to use it its no where. I find it in files. My old phone i opened my gallery and all my photosvideos where there. Now it seems I need a treasure map to locate photos. Its annoying, or am I doing something wrong??","Anyone have the Revvl 8?. Got this phone a few days ago. It seems decent so far. Only thing thats getting at me is photos. It seems theres so many folders the photos get put into. Like if Im on google and a I save a photo then I open my gallery to use it its no where. I find it in files. My old phone i opened my gallery and all my photosvideos where there. Now it seems I need a treasure map to locate photos. Its annoying, or am I doing something wrong??",0.5,Neutral
Can I port a number from Verizon to T-Mobile that is tied up in pending changes wVerizon?,"Completely frustrated with Verizon. Ordered 4 lines to upgrade and for 3.5 weeks, 1 line has been stuck and the new phone hasnt shipped. No one can fix it at Verizon. I need to port 4 numbers from Verizon, 1 number is tied up in pending changes. So, 3 lines have been processed, 1 is stuck. Of the 3 processed - only 1 phone was sent back as a trade-in. I have possession of the upgraded phones for the other 2 lines but neither has been activated because Im trying to figure out my next move here. Id like to cancelreturn the 3 upgraded phones we received, within the 30 day return policy, and port all 4 numbers over to TMobile. Im hoping that cancelling the entire order of 4 upgrades will release the 1 that is stuck wont be pending changes anymore, it will be cancelled. If for some reason, that doesnt unstick the 1 number....is it possible to port it anyway? What would stop a number from being ported? ETA One of the upgraded phones is still within the 30 return window. I dont mind eating some restocking fees, but the 1,100 17 pro cost of the phone, if I decide to keep it gives me pause. Option 1 Keep the new phone and bring to TMO. This involves paying 100 of the phone cost as it was a free trade-in . Option 2 Return the new phone within the 30 day window. Issue here is then this line will not have a phone for however long it takes Verizon to accept and process the returns on my account, because I returned the OG phone as a trade-in and zero chance of getting it back, its already been processed, too.","Can I port a number from Verizon to T-Mobile that is tied up in pending changes wVerizon?. Completely frustrated with Verizon. Ordered 4 lines to upgrade and for 3.5 weeks, 1 line has been stuck and the new phone hasnt shipped. No one can fix it at Verizon. I need to port 4 numbers from Verizon, 1 number is tied up in pending changes. So, 3 lines have been processed, 1 is stuck. Of the 3 processed - only 1 phone was sent back as a trade-in. I have possession of the upgraded phones for the other 2 lines but neither has been activated because Im trying to figure out my next move here. Id like to cancelreturn the 3 upgraded phones we received, within the 30 day return policy, and port all 4 numbers over to TMobile. Im hoping that cancelling the entire order of 4 upgrades will release the 1 that is stuck wont be pending changes anymore, it will be cancelled. If for some reason, that doesnt unstick the 1 number....is it possible to port it anyway? What would stop a number from being ported? ETA One of the upgraded phones is still within the 30 return window. I dont mind eating some restocking fees, but the 1,100 17 pro cost of the phone, if I decide to keep it gives me pause. Option 1 Keep the new phone and bring to TMO. This involves paying 100 of the phone cost as it was a free trade-in . Option 2 Return the new phone within the 30 day window. Issue here is then this line will not have a phone for however long it takes Verizon to accept and process the returns on my account, because I returned the OG phone as a trade-in and zero chance of getting it back, its already been processed, too",0.5,Neutral
Connecting to n41 at 40Mhz and 50Mhz - will they get upgraded?,"Im in Monroe NY in Orange County. I have a T-Mobile business internet line, static IP. Its connecting to 4 bands at a time, two of which are n41. Does anyone know ifwhen the tower may get upgraded? Its been like this for a while and I see a lot of people posting they see n41 at 90 or 100Mhz Thanks!","Connecting to n41 at 40Mhz and 50Mhz - will they get upgraded?. Im in Monroe NY in Orange County. I have a T-Mobile business internet line, static IP. Its connecting to 4 bands at a time, two of which are n41. Does anyone know ifwhen the tower may get upgraded? Its been like this for a while and I see a lot of people posting they see n41 at 90 or 100Mhz Thanks!",1.0,Positive
